page,line_enum,text,tokens,x0,y0,x1,y1,width,height,empty_line,only_special,only_special_len,text_wo_numbers,text_wo_numbers_len,text_duplicated,to_delete_line
1,0,Exhibit 10.1,2,505.8125305175781,51.24300003051758,544.9500732421875,58.81800079345703,39.16254,7.6,False,Exhibit 101,2,Exhibit .,2,False,False
1,1,"[***] = Certain confidential information contained in this document,",9,317.70001220703125,60.08089065551758,544.9498901367188,67.65589141845703,227.27488,7.6,False,Certain confidential information contained in this document,7,"[***] = Certain confidential information contained in this document,",9,False,False
1,2,"marked by brackets, has been omitted because it is both",10,361.88751220703125,68.91877746582031,544.949951171875,76.49378204345703,183.08744,7.6,False,marked by brackets has been omitted because it is both,10,"marked by brackets, has been omitted because it is both",10,False,False
1,3,(i) not material and (ii) would likely be competitively harmful if publicly disclosed.,13,272.25,77.75666809082031,544.9500122070312,85.33167266845703,272.72501,7.6,False,i not material and ii would likely be competitively harmful if publicly disclosed,13,(i) not material and (ii) would likely be competitively harmful if publicly disclosed.,13,False,False
1,6,"(Execution Copy March 27, 2019)",5,440.1625061035156,113.07411193847656,544.9501953125,120.64910888671875,104.81269,7.6,False,Execution Copy March 27 2019,5,"(Execution Copy March , )",5,False,False
1,7,SUPPLY AGREEMENT,2,254.57501220703125,142.44886779785156,340.42510986328125,151.28636169433594,85.8751,8.86249,False,SUPPLY AGREEMENT,2,SUPPLY AGREEMENT,2,False,False
1,8,(MB Global Contract Number MBGCR 19001),6,222.38125610351562,159.9360809326172,373.2501220703125,168.142333984375,150.89387,8.23125,False,MB Global Contract Number MBGCR 19001,6,(MB Global Contract Number MBGCR ),6,False,False
1,9,"This Supply Agreement (this “Agreement”) is made and entered into, effective as of March 27, 2019 (the “Effective Date”), by and",21,50.04999923706055,177.1300811767578,544.9495239257812,185.9675750732422,494.92452,8.86249,False,This Supply Agreement this Agreement is made and entered into effective as of March 27 2019 the Effective Date by and,21,"This Supply Agreement (this “Agreement”) is made and entered into, effective as of March ,  (the “Effective Date”), by and",20,False,False
1,10,"between Miltenyi Biotec GmbH, a German corporation having an address at Friedrich-Ebert-Str. 68, 51429 Bergisch Gladbach, Germany",17,50.04999923706055,187.2296905517578,544.9496459960938,196.0671844482422,494.92465,8.86249,False,between Miltenyi Biotec GmbH a German corporation having an address at FriedrichEbertStr 68 51429 Bergisch Gladbach Germany,17,"between Miltenyi Biotec GmbH, a German corporation having an address at Friedrich-Ebert-Str. ,  Bergisch Gladbach, Germany",16,False,False
1,11,"(hereinafter referred to as “Miltenyi”), and Bellicum Pharmaceuticals, Inc., a US corporation, having a registered office at 2130 West",19,50.04999923706055,197.3292999267578,544.9500732421875,206.1667938232422,494.92507,8.86249,False,hereinafter referred to as Miltenyi and Bellicum Pharmaceuticals Inc a US corporation having a registered office at 2130 West,19,"(hereinafter referred to as “Miltenyi”), and Bellicum Pharmaceuticals, Inc., a US corporation, having a registered office at  West",18,False,False
1,12,"Holcombe Boulevard, Suite 800, Houston, TX 77030 (on behalf of itself and its Affiliates, individually and collectively referred to as",20,50.04999923706055,207.4289093017578,544.9503784179688,216.2664031982422,494.92538,8.86249,False,Holcombe Boulevard Suite 800 Houston TX 77030 on behalf of itself and its Affiliates individually and collectively referred to as,20,"Holcombe Boulevard, Suite , Houston, TX  (on behalf of itself and its Affiliates, individually and collectively referred to as",19,False,False
1,13,“Bellicum”). Miltenyi and Bellicum are sometimes referred to herein individually as a “Party” and collectively as the “Parties.”,18,50.04999923706055,217.5285186767578,495.7124938964844,226.3660125732422,445.68749,8.86249,False,Bellicum Miltenyi and Bellicum are sometimes referred to herein individually as a Party and collectively as the Parties,18,“Bellicum”). Miltenyi and Bellicum are sometimes referred to herein individually as a “Party” and collectively as the “Parties.”,18,False,False
1,14,RECITALS,1,276.0375061035156,235.24183654785156,318.9624938964844,244.07933044433594,42.94999,8.86249,False,RECITALS,1,RECITALS,1,False,False
1,15,"WHEREAS, Miltenyi is a biotechnology company having technology and expertise relating to, inter alia, monoclonal antibodies, cell",17,50.04999923706055,252.8800811767578,544.9503173828125,261.71759033203125,494.92532,8.86251,False,WHEREAS Miltenyi is a biotechnology company having technology and expertise relating to inter alia monoclonal antibodies cell,17,"WHEREAS, Miltenyi is a biotechnology company having technology and expertise relating to, inter alia, monoclonal antibodies, cell",17,False,False
1,16,"separation, and cell and gene therapy, and Miltenyi has developed and owns and controls various platform technologies for use in research",21,50.04999923706055,262.97967529296875,544.949951171875,271.81719970703125,494.92495,8.86252,False,separation and cell and gene therapy and Miltenyi has developed and owns and controls various platform technologies for use in research,21,"separation, and cell and gene therapy, and Miltenyi has developed and owns and controls various platform technologies for use in research",21,False,False
1,17,"and clinical applications and pharmaceutical development and manufacturing, including (i) systems, devices, reagents, disposables and",15,50.04999923706055,273.07928466796875,544.9501342773438,281.91680908203125,494.92514,8.86252,False,and clinical applications and pharmaceutical development and manufacturing including i systems devices reagents disposables and,15,"and clinical applications and pharmaceutical development and manufacturing, including (i) systems, devices, reagents, disposables and",15,False,False
1,18,"related procedures and protocols for cell processing (including cell enrichment, purification, activation, modification and expansion) and",16,50.04999923706055,283.17889404296875,544.9505615234375,292.01641845703125,494.92556,8.86252,False,related procedures and protocols for cell processing including cell enrichment purification activation modification and expansion and,16,"related procedures and protocols for cell processing (including cell enrichment, purification, activation, modification and expansion) and",16,False,False
1,19,"cell analysis, (ii) bioassay reagents, assays, probes and related materials, and (iii) clinical cell or sample processing systems;",18,50.04999923706055,293.27850341796875,491.2938537597656,302.11602783203125,441.26885,8.86252,False,cell analysis ii bioassay reagents assays probes and related materials and iii clinical cell or sample processing systems,18,"cell analysis, (ii) bioassay reagents, assays, probes and related materials, and (iii) clinical cell or sample processing systems;",18,False,False
1,20,"WHEREAS, Bellicum is a clinical stage biopharmaceutical company focused on discovering and developing cellular immunotherapies for",16,50.04999923706055,310.95428466796875,544.949951171875,319.79180908203125,494.92495,8.86252,False,WHEREAS Bellicum is a clinical stage biopharmaceutical company focused on discovering and developing cellular immunotherapies for,16,"WHEREAS, Bellicum is a clinical stage biopharmaceutical company focused on discovering and developing cellular immunotherapies for",16,False,False
1,21,"hematological cancers and solid tumors, as well as orphan inherited blood diseases;",12,50.04999923706055,321.05389404296875,346.73797607421875,329.89141845703125,296.71298,8.86252,False,hematological cancers and solid tumors as well as orphan inherited blood diseases,12,"hematological cancers and solid tumors, as well as orphan inherited blood diseases;",12,False,False
1,22,"WHEREAS, Bellicum desires to use certain Miltenyi Products (as defined below) solely for the Permitted Use (as defined below) in",20,50.04999923706055,338.72967529296875,544.9502563476562,347.56719970703125,494.92526,8.86252,False,WHEREAS Bellicum desires to use certain Miltenyi Products as defined below solely for the Permitted Use as defined below in,20,"WHEREAS, Bellicum desires to use certain Miltenyi Products (as defined below) solely for the Permitted Use (as defined below) in",20,False,False
1,23,connection with the development and manufacture of certain Bellicum Products (as defined below) by Bellicum and/or its Subcontractors,18,50.04999923706055,348.82928466796875,544.9500122070312,357.66680908203125,494.92501,8.86252,False,connection with the development and manufacture of certain Bellicum Products as defined below by Bellicum andor its Subcontractors,18,connection with the development and manufacture of certain Bellicum Products (as defined below) by Bellicum and/or its Subcontractors,18,False,False
1,24,"or Licensees (as defined below) for use in preclinical and clinical development programs and, if approved, for commercial use; and",20,50.04999923706055,358.92889404296875,517.8069458007812,367.76641845703125,467.78195,8.86252,False,or Licensees as defined below for use in preclinical and clinical development programs and if approved for commercial use and,20,"or Licensees (as defined below) for use in preclinical and clinical development programs and, if approved, for commercial use; and",20,False,False
1,25,"WHEREAS, Miltenyi desires to sell to Bellicum, and Bellicum desires to purchase from Miltenyi, the Miltenyi Products in accordance with",20,50.04999923706055,376.60467529296875,544.9502563476562,385.44219970703125,494.92526,8.86252,False,WHEREAS Miltenyi desires to sell to Bellicum and Bellicum desires to purchase from Miltenyi the Miltenyi Products in accordance with,20,"WHEREAS, Miltenyi desires to sell to Bellicum, and Bellicum desires to purchase from Miltenyi, the Miltenyi Products in accordance with",20,False,False
1,26,the terms and conditions set forth in this Agreement.,9,50.04999923706055,386.70428466796875,238.16261291503906,395.54180908203125,188.13761,8.86252,False,the terms and conditions set forth in this Agreement,9,the terms and conditions set forth in this Agreement.,9,False,False
1,27,"NOW, THEREFORE, in consideration of the foregoing and the mutual covenants contained herein, the Parties agree as follows:",18,50.04999923706055,404.38006591796875,504.5499267578125,413.21759033203125,454.52493,8.86252,False,NOW THEREFORE in consideration of the foregoing and the mutual covenants contained herein the Parties agree as follows,18,"NOW, THEREFORE, in consideration of the foregoing and the mutual covenants contained herein, the Parties agree as follows:",18,False,False
1,28,Article 1 DEFINITIONS AND INTERPRETATION,5,205.33750915527344,422.05389404296875,389.6625671386719,430.89141845703125,184.35006,8.86252,False,Article 1 DEFINITIONS AND INTERPRETATION,5,Article  DEFINITIONS AND INTERPRETATION,4,False,False
1,29,"1.1 Definitions. For the purposes of this Agreement, unless the context requires otherwise, the following terms shall have the meanings set",21,50.04999923706055,439.72967529296875,544.949951171875,448.56719970703125,494.92495,8.86252,False,11 Definitions For the purposes of this Agreement unless the context requires otherwise the following terms shall have the meanings set,21,". Definitions. For the purposes of this Agreement, unless the context requires otherwise, the following terms shall have the meanings set",21,False,False
1,30,forth below:,2,50.04999923706055,450.46014404296875,93.60625457763672,459.29766845703125,43.58126,8.86252,False,forth below,2,forth below:,2,False,False
1,31,“Additional Countries” shall have the meaning set forth in Section 2.3 of this Agreement.,14,50.04999923706055,468.13592529296875,365.6749267578125,476.97344970703125,315.64993,8.86252,False,Additional Countries shall have the meaning set forth in Section 23 of this Agreement,14,“Additional Countries” shall have the meaning set forth in Section . of this Agreement.,14,False,False
1,32,"“Affiliate” means, with respect to a Party, any corporation, association, or other entity which, directly or indirectly, controls the Party or",21,50.04999923706055,485.80975341796875,544.9505615234375,494.64727783203125,494.92556,8.86252,False,Affiliate means with respect to a Party any corporation association or other entity which directly or indirectly controls the Party or,21,"“Affiliate” means, with respect to a Party, any corporation, association, or other entity which, directly or indirectly, controls the Party or",21,False,False
1,33,"is controlled by the Party or is under common control with such Party, where “control“ means the possession, directly or indirectly, of",22,50.04999923706055,495.91131591796875,544.9500732421875,504.74884033203125,494.92507,8.86252,False,is controlled by the Party or is under common control with such Party where control means the possession directly or indirectly of,22,"is controlled by the Party or is under common control with such Party, where “control“ means the possession, directly or indirectly, of",22,False,False
1,34,"the power to direct or cause the direction of the affairs or management of a corporation, association, or other entity through the",22,50.04999923706055,506.01092529296875,544.95068359375,514.8484497070312,494.92568,8.86252,False,the power to direct or cause the direction of the affairs or management of a corporation association or other entity through the,22,"the power to direct or cause the direction of the affairs or management of a corporation, association, or other entity through the",22,False,False
1,35,ownership of fifty percent,4,50.04999923706055,516.1105346679688,144.1062469482422,524.9480590820312,94.08125,8.86252,False,ownership of fifty percent,4,ownership of fifty percent,4,False,False
2,3,"or more of the voting securities or otherwise, including having the power to elect a majority of the board of directors or other governing",24,50.04999923706055,101.38398742675781,544.9508666992188,110.22148895263672,494.92587,8.8625,False,or more of the voting securities or otherwise including having the power to elect a majority of the board of directors or other governing,24,"or more of the voting securities or otherwise, including having the power to elect a majority of the board of directors or other governing",24,False,False
2,4,"body of such corporation, association, or other entity.",8,50.04999923706055,112.74726867675781,242.58140563964844,121.58477020263672,192.55641,8.8625,False,body of such corporation association or other entity,8,"body of such corporation, association, or other entity.",8,False,False
2,5,"“Agreed Standards” means all standards, specifications, guidelines and regulations as to quality, safety and performance as are consistently",18,50.04999923706055,134.2082061767578,544.9496459960938,143.0457000732422,494.92465,8.86249,False,Agreed Standards means all standards specifications guidelines and regulations as to quality safety and performance as are consistently,18,"“Agreed Standards” means all standards, specifications, guidelines and regulations as to quality, safety and performance as are consistently",18,False,False
2,6,applied by Miltenyi from time to time with respect to the manufacture and quality control of the relevant Miltenyi Product in accordance,22,50.04999923706055,145.5714874267578,544.9503784179688,154.4089813232422,494.92538,8.86249,False,applied by Miltenyi from time to time with respect to the manufacture and quality control of the relevant Miltenyi Product in accordance,22,applied by Miltenyi from time to time with respect to the manufacture and quality control of the relevant Miltenyi Product in accordance,22,False,False
2,7,"with Miltenyi’s established quality system, standard operating procedures, and quality control procedures, and includes (i) any standard(s)",17,50.04999923706055,156.9347686767578,544.9493408203125,165.7722625732422,494.92434,8.86249,False,with Miltenyis established quality system standard operating procedures and quality control procedures and includes i any standards,17,"with Miltenyi’s established quality system, standard operating procedures, and quality control procedures, and includes (i) any standard(s)",17,False,False
2,8,as may be specifically determined to be applicable to the manufacture and quality control of the relevant Miltenyi Product (if any) (for,22,50.04999923706055,168.2960968017578,544.9500732421875,177.1335906982422,494.92507,8.86249,False,as may be specifically determined to be applicable to the manufacture and quality control of the relevant Miltenyi Product if any for,22,as may be specifically determined to be applicable to the manufacture and quality control of the relevant Miltenyi Product (if any) (for,22,False,False
2,9,"example, with regard to the manufacturing of cell processing reagents or processing aids) by agreement between Miltenyi and any relevant",20,50.04999923706055,179.6593780517578,544.9501953125,188.4968719482422,494.9252,8.86249,False,example with regard to the manufacturing of cell processing reagents or processing aids by agreement between Miltenyi and any relevant,20,"example, with regard to the manufacturing of cell processing reagents or processing aids) by agreement between Miltenyi and any relevant",20,False,False
2,10,Regulatory Authority/ies and as set forth in Miltenyi’s relevant Master Files and/or the Quality Agreement and (ii) any standard(s) as may,21,50.04999923706055,191.0207061767578,544.9498901367188,199.8582000732422,494.92489,8.86249,False,Regulatory Authorityies and as set forth in Miltenyis relevant Master Files andor the Quality Agreement and ii any standards as may,21,Regulatory Authority/ies and as set forth in Miltenyi’s relevant Master Files and/or the Quality Agreement and (ii) any standard(s) as may,21,False,False
2,11,be expressly agreed between the Parties with respect to a relevant Miltenyi Product from time to time in writing in this Agreement or in an,25,50.04999923706055,202.3839874267578,544.949462890625,211.2214813232422,494.92446,8.86249,False,be expressly agreed between the Parties with respect to a relevant Miltenyi Product from time to time in writing in this Agreement or in an,25,be expressly agreed between the Parties with respect to a relevant Miltenyi Product from time to time in writing in this Agreement or in an,25,False,False
2,12,amendment to this Agreement.,4,50.04999923706055,213.7472686767578,159.25634765625,222.5847625732422,109.23135,8.86249,False,amendment to this Agreement,4,amendment to this Agreement.,4,False,False
2,13,"“Agreement” means this Supply Agreement, including Exhibits A, B, C, D, E, F and G attached hereto and incorporated herein, as",21,50.04999923706055,235.2082061767578,544.9500122070312,244.0457000732422,494.92501,8.86249,False,Agreement means this Supply Agreement including Exhibits A B C D E F and G attached hereto and incorporated herein as,21,"“Agreement” means this Supply Agreement, including Exhibits A, B, C, D, E, F and G attached hereto and incorporated herein, as",21,False,False
2,14,amended from time to time in accordance with Section 20.3 hereof.,11,50.04999923706055,246.5714874267578,292.4501647949219,255.4089813232422,242.42517,8.86249,False,amended from time to time in accordance with Section 203 hereof,11,amended from time to time in accordance with Section . hereof.,11,False,False
2,15,"“Applicable Laws” means all supranational, national, state and local laws, rules and regulations and guidelines governing the activities of a",20,50.04999923706055,268.03436279296875,544.9495849609375,276.87188720703125,494.92459,8.86252,False,Applicable Laws means all supranational national state and local laws rules and regulations and guidelines governing the activities of a,20,"“Applicable Laws” means all supranational, national, state and local laws, rules and regulations and guidelines governing the activities of a",20,False,False
2,16,"Party described in this Agreement within the Territory that are applicable to the manufacture, use, storage, import, export and handling of",21,50.04999923706055,279.39569091796875,544.9509887695312,288.23321533203125,494.92599,8.86252,False,Party described in this Agreement within the Territory that are applicable to the manufacture use storage import export and handling of,21,"Party described in this Agreement within the Territory that are applicable to the manufacture, use, storage, import, export and handling of",21,False,False
2,17,"the Miltenyi Products, including any applicable rules, regulations, guidelines, and other requirements of any Regulatory Authority that may",18,50.04999923706055,290.75897216796875,544.9496459960938,299.59649658203125,494.92465,8.86252,False,the Miltenyi Products including any applicable rules regulations guidelines and other requirements of any Regulatory Authority that may,18,"the Miltenyi Products, including any applicable rules, regulations, guidelines, and other requirements of any Regulatory Authority that may",18,False,False
2,18,be in effect in the Territory from time to time.,10,50.04999923706055,302.12225341796875,214.1751708984375,310.95977783203125,164.15017,8.86252,False,be in effect in the Territory from time to time,10,be in effect in the Territory from time to time.,10,False,False
2,19,“Bellicum Product” means one or more cell-based therapeutic product(s) that are manufactured using one or more Miltenyi Products and,19,50.04999923706055,323.58319091796875,544.9495239257812,332.42071533203125,494.92452,8.86252,False,Bellicum Product means one or more cellbased therapeutic products that are manufactured using one or more Miltenyi Products and,19,“Bellicum Product” means one or more cell-based therapeutic product(s) that are manufactured using one or more Miltenyi Products and,19,False,False
2,20,"that are researched, developed and/or commercialized by or on behalf of Bellicum in the Field, as such products are identified in Modules",22,50.04999923706055,334.94647216796875,544.9508056640625,343.78399658203125,494.92581,8.86252,False,that are researched developed andor commercialized by or on behalf of Bellicum in the Field as such products are identified in Modules,22,"that are researched, developed and/or commercialized by or on behalf of Bellicum in the Field, as such products are identified in Modules",22,False,False
2,21,"set forth in Exhibit A to this Agreement, including related development candidate(s) and investigational cell-based therapeutics used under",18,50.04999923706055,346.30975341796875,544.9503173828125,355.14727783203125,494.92532,8.86252,False,set forth in Exhibit A to this Agreement including related development candidates and investigational cellbased therapeutics used under,18,"set forth in Exhibit A to this Agreement, including related development candidate(s) and investigational cell-based therapeutics used under",18,False,False
2,22,"the sponsorship of Bellicum and as further specified in the applicable Module, as such Module may be amended from time to time by",23,50.04999923706055,357.67108154296875,544.9498901367188,366.50860595703125,494.92489,8.86252,False,the sponsorship of Bellicum and as further specified in the applicable Module as such Module may be amended from time to time by,23,"the sponsorship of Bellicum and as further specified in the applicable Module, as such Module may be amended from time to time by",23,False,False
2,23,written notification of Bellicum to Miltenyi to add or remove product(s) in the Field.,14,50.04999923706055,369.03436279296875,349.2628479003906,377.87188720703125,299.23785,8.86252,False,written notification of Bellicum to Miltenyi to add or remove products in the Field,14,written notification of Bellicum to Miltenyi to add or remove product(s) in the Field.,14,False,False
2,24,"“Bellicum Program” means a specific Bellicum program for preclinical, clinical development and/or commercialization relating to one or",17,50.04999923706055,390.49725341796875,544.9503173828125,399.33477783203125,494.92532,8.86252,False,Bellicum Program means a specific Bellicum program for preclinical clinical development andor commercialization relating to one or,17,"“Bellicum Program” means a specific Bellicum program for preclinical, clinical development and/or commercialization relating to one or",17,False,False
2,25,more Bellicum Products as such program is identified and described in a Module to this Agreement.,16,50.04999923706055,401.85858154296875,405.4438781738281,410.69610595703125,355.41888,8.86252,False,more Bellicum Products as such program is identified and described in a Module to this Agreement,16,more Bellicum Products as such program is identified and described in a Module to this Agreement.,16,False,False
2,26,"“Business Day” means any day on which banking institutions in both San Francisco, US, and Bergisch Gladbach, Germany, are open for",21,50.04999923706055,423.32147216796875,544.9501953125,432.15899658203125,494.9252,8.86252,False,Business Day means any day on which banking institutions in both San Francisco US and Bergisch Gladbach Germany are open for,21,"“Business Day” means any day on which banking institutions in both San Francisco, US, and Bergisch Gladbach, Germany, are open for",21,False,False
2,27,business,1,50.04999923706055,434.68475341796875,80.34999084472656,443.52227783203125,30.32499,8.86252,False,business,1,business,1,False,False
