page,line_enum,text,tokens,x0,y0,x1,y1,width,height,empty_line,only_special,only_special_len,text_wo_numbers,text_wo_numbers_len,text_duplicated,to_delete_line
22,14,"(c) Upon Delivery, Bellicum will cause its carrier to verify the gross and visually observable physical integrity of all Miltenyi Product",21,50.04999923706055,229.5226593017578,544.9498901367188,238.3601531982422,494.92489,8.86249,False,c Upon Delivery Bellicum will cause its carrier to verify the gross and visually observable physical integrity of all Miltenyi Product,21,"(c) Upon Delivery, Bellicum will cause its carrier to verify the gross and visually observable physical integrity of all Miltenyi Product",21,False,False
22,15,packaging prior to loading and to acknowledge proper receipt of the Miltenyi Products by signing the relevant transport documentation.,19,50.04999923706055,240.2541046142578,532.955810546875,249.0915985107422,482.93081,8.86249,False,packaging prior to loading and to acknowledge proper receipt of the Miltenyi Products by signing the relevant transport documentation,19,packaging prior to loading and to acknowledge proper receipt of the Miltenyi Products by signing the relevant transport documentation.,19,False,False
22,16,(d) Miltenyi shall have the Miltenyi Products appropriately labelled with a traceable lot or batch number and packaged for shipping in,21,50.04999923706055,258.55975341796875,544.9497680664062,267.39727783203125,494.92477,8.86252,False,d Miltenyi shall have the Miltenyi Products appropriately labelled with a traceable lot or batch number and packaged for shipping in,21,(d) Miltenyi shall have the Miltenyi Products appropriately labelled with a traceable lot or batch number and packaged for shipping in,21,False,False
22,17,"commercial packaging materials in compliance with Agreed Standards, Miltenyi’s standard procedures and, the applicable Quality",15,50.04999923706055,269.29119873046875,544.9496459960938,278.12872314453125,494.92465,8.86252,False,commercial packaging materials in compliance with Agreed Standards Miltenyis standard procedures and the applicable Quality,15,"commercial packaging materials in compliance with Agreed Standards, Miltenyi’s standard procedures and, the applicable Quality",15,False,False
22,19,(e) Quantities actually Delivered to Bellicum or Bellicum’s designee pursuant to an accepted Purchase Order may not vary from the,20,50.04999923706055,297.69744873046875,544.94970703125,306.53497314453125,494.92471,8.86252,False,e Quantities actually Delivered to Bellicum or Bellicums designee pursuant to an accepted Purchase Order may not vary from the,20,(e) Quantities actually Delivered to Bellicum or Bellicum’s designee pursuant to an accepted Purchase Order may not vary from the,20,False,False
22,20,"quantities reflected in such Purchase Order without Bellicums’ prior written consent; provided, however, that if Bellicum so consents to a",20,50.04999923706055,308.42889404296875,544.9498291015625,317.26641845703125,494.92483,8.86252,False,quantities reflected in such Purchase Order without Bellicums prior written consent provided however that if Bellicum so consents to a,20,"quantities reflected in such Purchase Order without Bellicums’ prior written consent; provided, however, that if Bellicum so consents to a",20,False,False
22,21,"variance in quantities actually Delivered (as compared to quantities set forth in an accepted Purchase Order), Bellicum shall only be",20,50.04999923706055,318.52850341796875,544.9501953125,327.36602783203125,494.9252,8.86252,False,variance in quantities actually Delivered as compared to quantities set forth in an accepted Purchase Order Bellicum shall only be,20,"variance in quantities actually Delivered (as compared to quantities set forth in an accepted Purchase Order), Bellicum shall only be",20,False,False
22,22,invoiced and required to pay for the quantities of Miltenyi Product that Miltenyi actually Delivered to Bellicum or Bellicum’s designee. In,21,50.04999923706055,328.62908935546875,544.9500122070312,337.46661376953125,494.92501,8.86252,False,invoiced and required to pay for the quantities of Miltenyi Product that Miltenyi actually Delivered to Bellicum or Bellicums designee In,21,invoiced and required to pay for the quantities of Miltenyi Product that Miltenyi actually Delivered to Bellicum or Bellicum’s designee. In,21,False,False
22,23,"the event that Bellicum consents to accept Delivery of less than the quantities of Miltenyi Product in an accepted Purchase Order, Miltenyi",22,50.04999923706055,338.72869873046875,544.950439453125,347.56622314453125,494.92544,8.86252,False,the event that Bellicum consents to accept Delivery of less than the quantities of Miltenyi Product in an accepted Purchase Order Miltenyi,22,"the event that Bellicum consents to accept Delivery of less than the quantities of Miltenyi Product in an accepted Purchase Order, Miltenyi",22,False,False
22,24,"shall include, in the next shipment of Miltenyi Product to Bellicum, any quantities ordered pursuant to an accepted Purchase Order but not",22,50.04999923706055,348.82928466796875,544.9508056640625,357.66680908203125,494.92581,8.86252,False,shall include in the next shipment of Miltenyi Product to Bellicum any quantities ordered pursuant to an accepted Purchase Order but not,22,"shall include, in the next shipment of Miltenyi Product to Bellicum, any quantities ordered pursuant to an accepted Purchase Order but not",22,False,False
22,25,"actually delivered on the designated Delivery date. If a delay in any such Delivery of Miltenyi Products exceeds ten (10) Days, then",22,50.04999923706055,358.92889404296875,544.9498901367188,367.76641845703125,494.92489,8.86252,False,actually delivered on the designated Delivery date If a delay in any such Delivery of Miltenyi Products exceeds ten 10 Days then,22,"actually delivered on the designated Delivery date. If a delay in any such Delivery of Miltenyi Products exceeds ten () Days, then",22,False,False
22,26,Bellicum may require a pro rata reduction in its then-current Monthly Forecast to account for such delay.,17,50.04999923706055,369.02850341796875,425.6434631347656,377.86602783203125,375.61846,8.86252,False,Bellicum may require a pro rata reduction in its thencurrent Monthly Forecast to account for such delay,17,Bellicum may require a pro rata reduction in its then-current Monthly Forecast to account for such delay.,17,False,False
22,27,6.2 Title and Risk. Title and risk of loss or damage to Miltenyi Products shall pass to Bellicum as defined by Incoterm FCA (Incoterms,24,50.04999923706055,387.33514404296875,544.9500122070312,396.17266845703125,494.92501,8.86252,False,62 Title and Risk Title and risk of loss or damage to Miltenyi Products shall pass to Bellicum as defined by Incoterm FCA Incoterms,24,. Title and Risk. Title and risk of loss or damage to Miltenyi Products shall pass to Bellicum as defined by Incoterm FCA (Incoterms,24,False,False
22,28,"2010). Should any of the Delivered Miltenyi Products be damaged during transit to Bellicum or Bellicum’s designee, then notwithstanding",19,50.04999923706055,398.06658935546875,544.9495239257812,406.90411376953125,494.92452,8.86252,False,2010 Should any of the Delivered Miltenyi Products be damaged during transit to Bellicum or Bellicums designee then notwithstanding,19,"). Should any of the Delivered Miltenyi Products be damaged during transit to Bellicum or Bellicum’s designee, then notwithstanding",19,False,False
22,29,"anything to the contrary in Section 5.4, a replacement order to replace such damaged Miltenyi Products shall be fulfilled, even if the",22,50.04999923706055,408.16619873046875,544.9505004882812,417.00372314453125,494.9255,8.86252,False,anything to the contrary in Section 54 a replacement order to replace such damaged Miltenyi Products shall be fulfilled even if the,22,"anything to the contrary in Section ., a replacement order to replace such damaged Miltenyi Products shall be fulfilled, even if the",22,False,False
22,30,"volume limitations defined in Section 5.2 are exceeded, by Miltenyi in good faith and as soon as practicable (and such replacement order",22,50.04999923706055,418.26678466796875,544.9503173828125,427.10430908203125,494.92532,8.86252,False,volume limitations defined in Section 52 are exceeded by Miltenyi in good faith and as soon as practicable and such replacement order,22,"volume limitations defined in Section . are exceeded, by Miltenyi in good faith and as soon as practicable (and such replacement order",22,False,False
22,31,shall be considered a new Purchase Order during the applicable Firm Zone).,12,50.04999923706055,428.36639404296875,321.4877014160156,437.20391845703125,271.4627,8.86252,False,shall be considered a new Purchase Order during the applicable Firm Zone,12,shall be considered a new Purchase Order during the applicable Firm Zone).,12,False,False
22,32,"6.3 Partial Delivery. With Bellicum’s specific prior written consent, Miltenyi may make partial shipment against Purchase Orders, to be",19,50.04999923706055,446.67303466796875,544.9503784179688,455.51055908203125,494.92538,8.86252,False,63 Partial Delivery With Bellicums specific prior written consent Miltenyi may make partial shipment against Purchase Orders to be,19,". Partial Delivery. With Bellicum’s specific prior written consent, Miltenyi may make partial shipment against Purchase Orders, to be",19,False,False
22,33,"separately invoiced with each shipment and paid for when due in accordance with this Agreement. For such partial shipments, Miltenyi",20,50.04999923706055,457.40350341796875,544.9500732421875,466.24102783203125,494.92507,8.86252,False,separately invoiced with each shipment and paid for when due in accordance with this Agreement For such partial shipments Miltenyi,20,"separately invoiced with each shipment and paid for when due in accordance with this Agreement. For such partial shipments, Miltenyi",20,False,False
22,34,will pay all shipment costs associated with such subsequent or additional shipments.,12,50.04999923706055,467.50408935546875,350.5247802734375,476.34161376953125,300.49978,8.86252,False,will pay all shipment costs associated with such subsequent or additional shipments,12,will pay all shipment costs associated with such subsequent or additional shipments.,12,False,False
22,35,"6.4 Minimum Guaranteed Shelf Life. Miltenyi shall ensure that, at the time of Delivery the remaining shelf life of each shipped Miltenyi",22,50.04999923706055,485.80975341796875,544.9497680664062,494.64727783203125,494.92477,8.86252,False,64 Minimum Guaranteed Shelf Life Miltenyi shall ensure that at the time of Delivery the remaining shelf life of each shipped Miltenyi,22,". Minimum Guaranteed Shelf Life. Miltenyi shall ensure that, at the time of Delivery the remaining shelf life of each shipped Miltenyi",22,False,False
22,36,Product shall be no less than the minimum shelf life set forth in Exhibit B as such Exhibit B Module may be amended from time to time by,28,50.04999923706055,496.54119873046875,544.9498291015625,505.37872314453125,494.92483,8.86252,False,Product shall be no less than the minimum shelf life set forth in Exhibit B as such Exhibit B Module may be amended from time to time by,28,Product shall be no less than the minimum shelf life set forth in Exhibit B as such Exhibit B Module may be amended from time to time by,28,False,False
22,37,written notification of Miltenyi to Bellicum. As of the Effective Date the Minimum Guaranteed Shelf Life of certain Miltenyi Products is,21,50.04999923706055,506.64178466796875,544.9498901367188,515.4793090820312,494.92489,8.86252,False,written notification of Miltenyi to Bellicum As of the Effective Date the Minimum Guaranteed Shelf Life of certain Miltenyi Products is,21,written notification of Miltenyi to Bellicum. As of the Effective Date the Minimum Guaranteed Shelf Life of certain Miltenyi Products is,21,False,False
22,38,relatively short and thus requires Bellicum to perform a tight materials management (i.e. short-termed,14,50.04999923706055,516.7413940429688,411.12506103515625,525.5789184570312,361.10006,8.86252,False,relatively short and thus requires Bellicum to perform a tight materials management ie shorttermed,14,relatively short and thus requires Bellicum to perform a tight materials management (i.e. short-termed,14,False,False
23,3,ordering of such Miltenyi Products) regarding production planning of Bellicum Product. The Parties mutually agree to use their [...***...],19,50.04999923706055,101.37910461425781,544.950439453125,110.21660614013672,494.92544,8.8625,False,ordering of such Miltenyi Products regarding production planning of Bellicum Product The Parties mutually agree to use their,18,ordering of such Miltenyi Products) regarding production planning of Bellicum Product. The Parties mutually agree to use their [...***...],19,False,False
23,4,to implement any back-office activities as necessary to implement a) an increased Minimum Guaranteed Shelf Life and/or b),18,50.04999923706055,111.47920227050781,544.949951171875,120.31670379638672,494.92495,8.8625,False,to implement any backoffice activities as necessary to implement a an increased Minimum Guaranteed Shelf Life andor b,18,to implement any back-office activities as necessary to implement a) an increased Minimum Guaranteed Shelf Life and/or b),18,False,False
23,5,improvements to material management and production planning to address the challenge in the previous sentence and the Parties agree to,20,50.04999923706055,121.57929992675781,544.9496459960938,130.4167938232422,494.92465,8.86249,False,improvements to material management and production planning to address the challenge in the previous sentence and the Parties agree to,20,improvements to material management and production planning to address the challenge in the previous sentence and the Parties agree to,20,False,False
23,6,"provide to each other reasonable assistance where practicable to implement such back-office changes as necessary, taking into account",18,50.04999923706055,131.6793975830078,544.9503784179688,140.5168914794922,494.92538,8.86249,False,provide to each other reasonable assistance where practicable to implement such backoffice changes as necessary taking into account,18,"provide to each other reasonable assistance where practicable to implement such back-office changes as necessary, taking into account",18,False,False
23,7,"cost, resource and capacity requirements.",5,50.04999923706055,141.7790069580078,199.65626525878906,150.6165008544922,149.63127,8.86249,False,cost resource and capacity requirements,5,"cost, resource and capacity requirements.",5,False,False
23,8,"6.5 Certificates. Miltenyi shall include proper release certificates, certificates of compliance, and/or certificates of analysis with all",17,50.04999923706055,160.0856475830078,544.9500732421875,168.9231414794922,494.92507,8.86249,False,65 Certificates Miltenyi shall include proper release certificates certificates of compliance andor certificates of analysis with all,17,". Certificates. Miltenyi shall include proper release certificates, certificates of compliance, and/or certificates of analysis with all",17,False,False
23,9,"shipments of Miltenyi Product, as applicable, in accordance with the requirements of the Quality Agreement.",15,50.04999923706055,170.8166046142578,437.63739013671875,179.6540985107422,387.61239,8.86249,False,shipments of Miltenyi Product as applicable in accordance with the requirements of the Quality Agreement,15,"shipments of Miltenyi Product, as applicable, in accordance with the requirements of the Quality Agreement.",15,False,False
23,10,6.6 Product Shortage. Miltenyi shall promptly notify Bellicum of any potential or anticipated shortfall in the manufacturing or inventory of,20,50.04999923706055,189.1227569580078,544.9501342773438,197.9602508544922,494.92514,8.86249,False,66 Product Shortage Miltenyi shall promptly notify Bellicum of any potential or anticipated shortfall in the manufacturing or inventory of,20,. Product Shortage. Miltenyi shall promptly notify Bellicum of any potential or anticipated shortfall in the manufacturing or inventory of,20,False,False
23,11,any Miltenyi Product that may adversely affect the Delivery of such Miltenyi Product in accordance with Bellicum’s forecast requirements,19,50.04999923706055,199.8542022705078,544.9500122070312,208.6916961669922,494.92501,8.86249,False,any Miltenyi Product that may adversely affect the Delivery of such Miltenyi Product in accordance with Bellicums forecast requirements,19,any Miltenyi Product that may adversely affect the Delivery of such Miltenyi Product in accordance with Bellicum’s forecast requirements,19,False,False
23,12,and pending Purchase Orders therefor. If Miltenyi is unable to supply any Miltenyi Product subject to a pending Purchase Order for any,22,50.04999923706055,209.9542999267578,544.9502563476562,218.7917938232422,494.92526,8.86249,False,and pending Purchase Orders therefor If Miltenyi is unable to supply any Miltenyi Product subject to a pending Purchase Order for any,22,and pending Purchase Orders therefor. If Miltenyi is unable to supply any Miltenyi Product subject to a pending Purchase Order for any,22,False,False
23,13,"reason, then the Parties shall, in good faith, seek to agree on a revised date (or dates) for Delivery and Miltenyi shall undertake prompt and",25,50.04999923706055,220.0543975830078,544.9501342773438,228.8918914794922,494.92514,8.86249,False,reason then the Parties shall in good faith seek to agree on a revised date or dates for Delivery and Miltenyi shall undertake prompt and,25,"reason, then the Parties shall, in good faith, seek to agree on a revised date (or dates) for Delivery and Miltenyi shall undertake prompt and",25,False,False
23,14,"diligent efforts to mitigate the adverse impact on Bellicum. In the case of a limited availability of any Miltenyi Product, in selling such",23,50.04999923706055,230.1540069580078,544.9502563476562,238.9915008544922,494.92526,8.86249,False,diligent efforts to mitigate the adverse impact on Bellicum In the case of a limited availability of any Miltenyi Product in selling such,23,"diligent efforts to mitigate the adverse impact on Bellicum. In the case of a limited availability of any Miltenyi Product, in selling such",23,False,False
23,15,"Miltenyi Product, Miltenyi shall take into account the aggregate volume of Miltenyi Products purchased by Bellicum, and shall subject to",20,50.04999923706055,240.2541046142578,544.9502563476562,249.0915985107422,494.92526,8.86249,False,Miltenyi Product Miltenyi shall take into account the aggregate volume of Miltenyi Products purchased by Bellicum and shall subject to,20,"Miltenyi Product, Miltenyi shall take into account the aggregate volume of Miltenyi Products purchased by Bellicum, and shall subject to",20,False,False
23,16,reasonable ethical standards provide to Bellicum priority access to Miltenyi Product consistent with such Miltenyi Product purchase,17,50.04999923706055,250.3542022705078,544.9502563476562,259.19171142578125,494.92526,8.86251,False,reasonable ethical standards provide to Bellicum priority access to Miltenyi Product consistent with such Miltenyi Product purchase,17,reasonable ethical standards provide to Bellicum priority access to Miltenyi Product consistent with such Miltenyi Product purchase,17,False,False
23,17,volumes and critical medical needs. If due to the fault or error of Miltenyi or a Third-Party supplier or Subcontractor of Miltenyi or Force,24,50.04999923706055,260.45428466796875,544.9494018554688,269.29180908203125,494.9244,8.86252,False,volumes and critical medical needs If due to the fault or error of Miltenyi or a ThirdParty supplier or Subcontractor of Miltenyi or Force,24,volumes and critical medical needs. If due to the fault or error of Miltenyi or a Third-Party supplier or Subcontractor of Miltenyi or Force,24,False,False
23,18,"Majeure, Miltenyi fails to deliver any Miltenyi Product in the quantities specified in Bellicum's Purchase Order, Miltenyi shall use all",20,50.04999923706055,270.55438232421875,544.9506225585938,279.39190673828125,494.92562,8.86252,False,Majeure Miltenyi fails to deliver any Miltenyi Product in the quantities specified in Bellicums Purchase Order Miltenyi shall use all,20,"Majeure, Miltenyi fails to deliver any Miltenyi Product in the quantities specified in Bellicum's Purchase Order, Miltenyi shall use all",20,False,False
23,19,"[...***...] that may be necessary in order to minimize the shortfall, and deliver the ordered Miltenyi Product as soon as possible. If",22,50.04999923706055,280.65399169921875,544.949462890625,289.49151611328125,494.92446,8.86252,False,that may be necessary in order to minimize the shortfall and deliver the ordered Miltenyi Product as soon as possible If,21,"[...***...] that may be necessary in order to minimize the shortfall, and deliver the ordered Miltenyi Product as soon as possible. If",22,False,False
23,20,Miltenyi fails to propose a reasonably acceptable plan for the Delivery or if the delay is more than thirty (30) days following the confirmed,24,50.04999923706055,290.75408935546875,544.9500122070312,299.59161376953125,494.92501,8.86252,False,Miltenyi fails to propose a reasonably acceptable plan for the Delivery or if the delay is more than thirty 30 days following the confirmed,24,Miltenyi fails to propose a reasonably acceptable plan for the Delivery or if the delay is more than thirty () days following the confirmed,24,False,False
23,21,"Delivery Date, Bellicum may, at its reasonable election and notwithstanding anything to the contrary in the Agreement, cancel the Purchase",20,50.04999923706055,300.85418701171875,544.950439453125,309.69171142578125,494.92544,8.86252,False,Delivery Date Bellicum may at its reasonable election and notwithstanding anything to the contrary in the Agreement cancel the Purchase,20,"Delivery Date, Bellicum may, at its reasonable election and notwithstanding anything to the contrary in the Agreement, cancel the Purchase",20,False,False
23,22,Order(s) without penalty.,3,50.04999923706055,310.95428466796875,140.31875610351562,319.79180908203125,90.29376,8.86252,False,Orders without penalty,3,Order(s) without penalty.,3,False,False
23,23,6.7 Continuity of Supply.,4,50.04999923706055,329.26043701171875,139.37188720703125,338.09796142578125,89.34689,8.86252,False,67 Continuity of Supply,4,. Continuity of Supply.,4,False,False
23,24,"(a) Contingent upon Bellicum’s continued adherence to its obligations in accordance with this Agreement, including the Forecast",17,50.04999923706055,348.19793701171875,544.9500732421875,357.03546142578125,494.92507,8.86252,False,a Contingent upon Bellicums continued adherence to its obligations in accordance with this Agreement including the Forecast,17,"(a) Contingent upon Bellicum’s continued adherence to its obligations in accordance with this Agreement, including the Forecast",17,False,False
23,25,"obligations and Firm Zone Requirements pursuant to Sections 5.1 and 5.3 above, Miltenyi shall use [...***...] have and devote adequate",20,50.04999923706055,358.92938232421875,544.9495849609375,367.76690673828125,494.92459,8.86252,False,obligations and Firm Zone Requirements pursuant to Sections 51 and 53 above Miltenyi shall use  have and devote adequate,19,"obligations and Firm Zone Requirements pursuant to Sections . and . above, Miltenyi shall use [...***...] have and devote adequate",20,False,False
23,26,"manufacturing capacity to ensure continuous supply of Miltenyi Products to Belicum in accordance with the Forecasts during the Term,",19,50.04999923706055,369.02899169921875,544.9503173828125,377.86651611328125,494.92532,8.86252,False,manufacturing capacity to ensure continuous supply of Miltenyi Products to Belicum in accordance with the Forecasts during the Term,19,"manufacturing capacity to ensure continuous supply of Miltenyi Products to Belicum in accordance with the Forecasts during the Term,",19,False,False
23,27,"in accordance with the provisions of this Section 6.7. However, Miltenyi’s compliance with this Section 6.7(a) shall not require Miltenyi to",21,50.04999923706055,379.12908935546875,544.9500122070312,387.96661376953125,494.92501,8.86252,False,in accordance with the provisions of this Section 67 However Miltenyis compliance with this Section 67a shall not require Miltenyi to,21,"in accordance with the provisions of this Section .. However, Miltenyi’s compliance with this Section .(a) shall not require Miltenyi to",21,False,False
23,28,"incur any significant expenses to purchase new equipment, to install equipment purchased or requested by Bellicum, or to add (or, for",21,50.04999923706055,389.22918701171875,544.94970703125,398.06671142578125,494.92471,8.86252,False,incur any significant expenses to purchase new equipment to install equipment purchased or requested by Bellicum or to add or for,21,"incur any significant expenses to purchase new equipment, to install equipment purchased or requested by Bellicum, or to add (or, for",21,False,False
23,29,"clarity, allocate or dedicate) additional manufacturing or storage capacity for the manufacturing and supply of Miltenyi Products to",18,50.04999923706055,399.32928466796875,544.9496459960938,408.16680908203125,494.92465,8.86252,False,clarity allocate or dedicate additional manufacturing or storage capacity for the manufacturing and supply of Miltenyi Products to,18,"clarity, allocate or dedicate) additional manufacturing or storage capacity for the manufacturing and supply of Miltenyi Products to",18,False,False
23,30,Bellicum hereunder.,2,50.04999923706055,409.42938232421875,120.11876678466797,418.26690673828125,70.09377,8.86252,False,Bellicum hereunder,2,Bellicum hereunder.,2,False,False
