page,line_enum,text,tokens,x0,y0,x1,y1,width,height,empty_line,only_special,only_special_len,text_wo_numbers,text_wo_numbers_len,text_duplicated,to_delete_line
12,13,Subcontractors; product control techniques and methods of analysis; product release specifications; and/or presentation and content of,16,50.04999923706055,220.0529327392578,544.9505615234375,228.8904266357422,494.92556,8.86249,False,Subcontractors product control techniques and methods of analysis product release specifications andor presentation and content of,16,Subcontractors; product control techniques and methods of analysis; product release specifications; and/or presentation and content of,16,False,False
12,14,"relevant documentation, including certificates pursuant to Section 6.5) from time to time during the Term (each, a “Change”).",18,50.04999923706055,230.1535186767578,498.8687744140625,238.9910125732422,448.84378,8.86249,False,relevant documentation including certificates pursuant to Section 65 from time to time during the Term each a Change,18,"relevant documentation, including certificates pursuant to Section .) from time to time during the Term (each, a “Change”).",18,False,False
12,15,(b) Change Notification. Change notifications shall be provided in accordance with the applicable notification procedures set forth in the,19,50.04999923706055,248.4591827392578,544.9505615234375,257.29669189453125,494.92556,8.86251,False,b Change Notification Change notifications shall be provided in accordance with the applicable notification procedures set forth in the,19,(b) Change Notification. Change notifications shall be provided in accordance with the applicable notification procedures set forth in the,19,False,False
12,16,"Quality Agreement or in this Agreement. In the event that Miltenyi proposes a Material Change, unless such proposed Change is a",21,50.04999923706055,259.19061279296875,544.949951171875,268.02813720703125,494.92495,8.86252,False,Quality Agreement or in this Agreement In the event that Miltenyi proposes a Material Change unless such proposed Change is a,21,"Quality Agreement or in this Agreement. In the event that Miltenyi proposes a Material Change, unless such proposed Change is a",21,False,False
12,17,"Required Change pursuant to Section 3.2(c) below and there are compelling reasons for earlier implementation of such Required Change,",19,50.04999923706055,269.29022216796875,544.950439453125,278.12774658203125,494.92544,8.86252,False,Required Change pursuant to Section 32c below and there are compelling reasons for earlier implementation of such Required Change,19,"Required Change pursuant to Section .(c) below and there are compelling reasons for earlier implementation of such Required Change,",19,False,False
12,18,Miltenyi shall give Bellicum at least [...***...] months’ advance written notice prior to implementation of the proposed Material Change (a,20,50.04999923706055,279.39080810546875,544.949951171875,288.22833251953125,494.92495,8.86252,False,Miltenyi shall give Bellicum at least  months advance written notice prior to implementation of the proposed Material Change a,19,Miltenyi shall give Bellicum at least [...***...] months’ advance written notice prior to implementation of the proposed Material Change (a,20,False,False
12,19,“Change Notification”). Miltenyi shall be responsible for drafting relevant documentation and shall provide to Bellicum all information,17,50.04999923706055,289.49041748046875,544.9497680664062,298.32794189453125,494.92477,8.86252,False,Change Notification Miltenyi shall be responsible for drafting relevant documentation and shall provide to Bellicum all information,17,“Change Notification”). Miltenyi shall be responsible for drafting relevant documentation and shall provide to Bellicum all information,17,False,False
12,20,reasonably necessary for Bellicum to make appropriate filings with the applicable Regulatory Authority regarding any Change under this,18,50.04999923706055,299.59100341796875,544.9508056640625,308.42852783203125,494.92581,8.86252,False,reasonably necessary for Bellicum to make appropriate filings with the applicable Regulatory Authority regarding any Change under this,18,reasonably necessary for Bellicum to make appropriate filings with the applicable Regulatory Authority regarding any Change under this,18,False,False
12,21,"subsection, if applicable.",3,50.04999923706055,309.69061279296875,137.79376220703125,318.52813720703125,87.76876,8.86252,False,subsection if applicable,3,"subsection, if applicable.",3,False,False
12,22,(c) Changes Required for Compliance. If during the Term a Change is required to comply with changes in Agreed Standards made by,22,50.04999923706055,327.99725341796875,544.9500122070312,336.83477783203125,494.92501,8.86252,False,c Changes Required for Compliance If during the Term a Change is required to comply with changes in Agreed Standards made by,22,(c) Changes Required for Compliance. If during the Term a Change is required to comply with changes in Agreed Standards made by,22,False,False
12,23,"Regulatory Authorities, Applicable Laws and/or other requirements of a Regulatory Authority, or if Miltenyi determines, in its reasonable",18,50.04999923706055,338.72772216796875,544.949951171875,347.56524658203125,494.92495,8.86252,False,Regulatory Authorities Applicable Laws andor other requirements of a Regulatory Authority or if Miltenyi determines in its reasonable,18,"Regulatory Authorities, Applicable Laws and/or other requirements of a Regulatory Authority, or if Miltenyi determines, in its reasonable",18,False,False
12,24,"judgment, that a Change is required to address safety and/or quality issues in regard to the Miltenyi Product generally (in each case, a",23,50.04999923706055,348.82830810546875,544.9500732421875,357.66583251953125,494.92507,8.86252,False,judgment that a Change is required to address safety andor quality issues in regard to the Miltenyi Product generally in each case a,23,"judgment, that a Change is required to address safety and/or quality issues in regard to the Miltenyi Product generally (in each case, a",23,False,False
12,25,"“Required Change”), Miltenyi shall use [...***...] to implement such Required Change at its cost. However, in the event that a Required",21,50.04999923706055,358.92791748046875,544.9502563476562,367.76544189453125,494.92526,8.86252,False,Required Change Miltenyi shall use  to implement such Required Change at its cost However in the event that a Required,20,"“Required Change”), Miltenyi shall use [...***...] to implement such Required Change at its cost. However, in the event that a Required",21,False,False
12,26,Change is specifically related to the use of Miltenyi Product for a Permitted Use in relation to a Bellicum Product (a “Bellicum-Specific,22,50.04999923706055,369.02850341796875,544.9500732421875,377.86602783203125,494.92507,8.86252,False,Change is specifically related to the use of Miltenyi Product for a Permitted Use in relation to a Bellicum Product a BellicumSpecific,22,Change is specifically related to the use of Miltenyi Product for a Permitted Use in relation to a Bellicum Product (a “Bellicum-Specific,22,False,False
12,27,"Required Change”), then Miltenyi shall use [...***...] to implement such Bellicum-Specific Required Change only if and to the extent",19,50.04999923706055,379.12811279296875,544.9496459960938,387.96563720703125,494.92465,8.86252,False,Required Change then Miltenyi shall use  to implement such BellicumSpecific Required Change only if and to the extent,18,"Required Change”), then Miltenyi shall use [...***...] to implement such Bellicum-Specific Required Change only if and to the extent",19,False,False
12,28,Bellicum agrees to reimburse Miltenyi for all documented costs and expenses reasonably incurred by Miltenyi as a result of any such,21,50.04999923706055,389.22772216796875,544.9501342773438,398.06524658203125,494.92514,8.86252,False,Bellicum agrees to reimburse Miltenyi for all documented costs and expenses reasonably incurred by Miltenyi as a result of any such,21,Bellicum agrees to reimburse Miltenyi for all documented costs and expenses reasonably incurred by Miltenyi as a result of any such,21,False,False
12,29,"Bellicum-Specific Required Change. Prior to implementing a Required Change in accordance with this Section 3.2(c), Miltenyi shall",17,50.04999923706055,399.32830810546875,544.9498291015625,408.16583251953125,494.92483,8.86252,False,BellicumSpecific Required Change Prior to implementing a Required Change in accordance with this Section 32c Miltenyi shall,17,"Bellicum-Specific Required Change. Prior to implementing a Required Change in accordance with this Section .(c), Miltenyi shall",17,False,False
12,30,"promptly advise Bellicum as to any scheduling and/or Product Price adjustments which may result from any such Required Change, if",20,50.04999923706055,409.42791748046875,544.9503173828125,418.26544189453125,494.92532,8.86252,False,promptly advise Bellicum as to any scheduling andor Product Price adjustments which may result from any such Required Change if,20,"promptly advise Bellicum as to any scheduling and/or Product Price adjustments which may result from any such Required Change, if",20,False,False
12,31,"any. Miltenyi and Bellicum shall negotiate in good faith in an attempt to reach agreement on (i) the new Product Price, if any, for any",25,50.04999923706055,419.52850341796875,544.9506225585938,428.36602783203125,494.92562,8.86252,False,any Miltenyi and Bellicum shall negotiate in good faith in an attempt to reach agreement on i the new Product Price if any for any,25,"any. Miltenyi and Bellicum shall negotiate in good faith in an attempt to reach agreement on (i) the new Product Price, if any, for any",25,False,False
12,32,"Miltenyi Product which embodies such Required Change, giving due consideration to the effect of such change on Miltenyi’s",18,50.04999923706055,429.62811279296875,544.9502563476562,438.46563720703125,494.92526,8.86252,False,Miltenyi Product which embodies such Required Change giving due consideration to the effect of such change on Miltenyis,18,"Miltenyi Product which embodies such Required Change, giving due consideration to the effect of such change on Miltenyi’s",18,False,False
12,33,"manufacturing costs for the changed Miltenyi Product as well as any other relevant factors, (ii) the responsibility for any costs and",21,50.04999923706055,439.72772216796875,544.9505004882812,448.56524658203125,494.9255,8.86252,False,manufacturing costs for the changed Miltenyi Product as well as any other relevant factors ii the responsibility for any costs and,21,"manufacturing costs for the changed Miltenyi Product as well as any other relevant factors, (ii) the responsibility for any costs and",21,False,False
12,34,"expenses associated with Miltenyi’s activities required to implement such Change, and (iii) any other amendments to this Agreement which",19,50.04999923706055,449.82830810546875,544.9494018554688,458.66583251953125,494.9244,8.86252,False,expenses associated with Miltenyis activities required to implement such Change and iii any other amendments to this Agreement which,19,"expenses associated with Miltenyi’s activities required to implement such Change, and (iii) any other amendments to this Agreement which",19,False,False
12,35,"may be necessitated by such Change (e.g., an adjustment to the lead time for firm orders). For clarity, Miltenyi shall have no obligation to",24,50.04999923706055,459.92791748046875,544.9502563476562,468.76544189453125,494.92526,8.86252,False,may be necessitated by such Change eg an adjustment to the lead time for firm orders For clarity Miltenyi shall have no obligation to,24,"may be necessitated by such Change (e.g., an adjustment to the lead time for firm orders). For clarity, Miltenyi shall have no obligation to",24,False,False
12,36,implement a Bellicum-Specific Required Change unless and until the Parties have reached agreement on all items as described in the,20,50.04999923706055,470.02850341796875,544.9503173828125,478.86602783203125,494.92532,8.86252,False,implement a BellicumSpecific Required Change unless and until the Parties have reached agreement on all items as described in the,20,implement a Bellicum-Specific Required Change unless and until the Parties have reached agreement on all items as described in the,20,False,False
12,37,preceding sentence.,2,50.04999923706055,480.12811279296875,120.75004577636719,488.96563720703125,70.72505,8.86252,False,preceding sentence,2,preceding sentence.,2,False,False
12,38,(d) Changes Requested by Bellicum. If during the Term Bellicum desires Miltenyi to make any Change not necessary to comply with,21,50.04999923706055,498.43475341796875,544.9501342773438,507.27227783203125,494.92514,8.86252,False,d Changes Requested by Bellicum If during the Term Bellicum desires Miltenyi to make any Change not necessary to comply with,21,(d) Changes Requested by Bellicum. If during the Term Bellicum desires Miltenyi to make any Change not necessary to comply with,21,False,False
12,39,changes in Agreed Standards made by Regulatory,7,50.04999923706055,509.16522216796875,227.43141174316406,518.0027465820312,177.40641,8.86252,False,changes in Agreed Standards made by Regulatory,7,changes in Agreed Standards made by Regulatory,7,False,False
13,3,"Authorities, Applicable Laws and/or other requirements of Regulatory Authorities (in each case, a “Bellicum-Requested Change”), Bellicum",16,50.04999923706055,101.37715148925781,544.9500122070312,110.21465301513672,494.92501,8.8625,False,Authorities Applicable Laws andor other requirements of Regulatory Authorities in each case a BellicumRequested Change Bellicum,16,"Authorities, Applicable Laws and/or other requirements of Regulatory Authorities (in each case, a “Bellicum-Requested Change”), Bellicum",16,False,False
13,4,shall notify Miltenyi thereof in writing. Implementation of any such proposed Bellicum-Requested Change shall be subject to Miltenyi’s,18,50.04999923706055,111.47676086425781,544.9500122070312,120.31426239013672,494.92501,8.8625,False,shall notify Miltenyi thereof in writing Implementation of any such proposed BellicumRequested Change shall be subject to Miltenyis,18,shall notify Miltenyi thereof in writing. Implementation of any such proposed Bellicum-Requested Change shall be subject to Miltenyi’s,18,False,False
13,5,consent. Miltenyi may withhold its consent to an Bellicum-Requested Change if Miltenyi reasonably determines that such change (i) does,19,50.04999923706055,121.57637023925781,544.9494018554688,130.4138641357422,494.9244,8.86249,False,consent Miltenyi may withhold its consent to an BellicumRequested Change if Miltenyi reasonably determines that such change i does,19,consent. Miltenyi may withhold its consent to an Bellicum-Requested Change if Miltenyi reasonably determines that such change (i) does,19,False,False
13,6,"not comply with Agreed Standards, Applicable Laws or the requirements of Miltenyi’s applicable Regulatory Authority, or (ii) could have",19,50.04999923706055,131.6769561767578,544.949951171875,140.5144500732422,494.92495,8.86249,False,not comply with Agreed Standards Applicable Laws or the requirements of Miltenyis applicable Regulatory Authority or ii could have,19,"not comply with Agreed Standards, Applicable Laws or the requirements of Miltenyi’s applicable Regulatory Authority, or (ii) could have",19,False,False
13,7,potential adverse impact on Miltenyi’s manufacturing activities or the sale of the respective Miltenyi Product to other customers. In,19,50.04999923706055,141.7765655517578,544.9502563476562,150.6140594482422,494.92526,8.86249,False,potential adverse impact on Miltenyis manufacturing activities or the sale of the respective Miltenyi Product to other customers In,19,potential adverse impact on Miltenyi’s manufacturing activities or the sale of the respective Miltenyi Product to other customers. In,19,False,False
13,8,"addition, a Bellicum-Requested Change shall only be implemented following a technical and cost review which shall be conducted as",19,50.04999923706055,151.8771514892578,544.9500732421875,160.7146453857422,494.92507,8.86249,False,addition a BellicumRequested Change shall only be implemented following a technical and cost review which shall be conducted as,19,"addition, a Bellicum-Requested Change shall only be implemented following a technical and cost review which shall be conducted as",19,False,False
13,9,"promptly as is reasonably possible and in good faith by Miltenyi, at Bellicum’s cost, and shall be subject to Miltenyi and Bellicum reaching",23,50.04999923706055,161.9767608642578,544.9501342773438,170.8142547607422,494.92514,8.86249,False,promptly as is reasonably possible and in good faith by Miltenyi at Bellicums cost and shall be subject to Miltenyi and Bellicum reaching,23,"promptly as is reasonably possible and in good faith by Miltenyi, at Bellicum’s cost, and shall be subject to Miltenyi and Bellicum reaching",23,False,False
13,10,agreement as to the one-time costs and revisions to the Product Price necessitated by any such Bellicum-Requested Change. If Bellicum,20,50.04999923706055,172.0763702392578,544.9498291015625,180.9138641357422,494.92483,8.86249,False,agreement as to the onetime costs and revisions to the Product Price necessitated by any such BellicumRequested Change If Bellicum,20,agreement as to the one-time costs and revisions to the Product Price necessitated by any such Bellicum-Requested Change. If Bellicum,20,False,False
13,11,agrees to reimburse Miltenyi for all documented costs and expenses reasonably incurred by Miltenyi as a result of the proposed Bellicum-,21,50.04999923706055,182.1769561767578,544.950439453125,191.0144500732422,494.92544,8.86249,False,agrees to reimburse Miltenyi for all documented costs and expenses reasonably incurred by Miltenyi as a result of the proposed Bellicum,21,agrees to reimburse Miltenyi for all documented costs and expenses reasonably incurred by Miltenyi as a result of the proposed Bellicum-,21,False,False
13,12,Requested Change and accepts a proposed Product Price adjustment that reflects a change in Miltenyi manufacturing costs resulting from,19,50.04999923706055,192.2765655517578,544.9501953125,201.1140594482422,494.9252,8.86249,False,Requested Change and accepts a proposed Product Price adjustment that reflects a change in Miltenyi manufacturing costs resulting from,19,Requested Change and accepts a proposed Product Price adjustment that reflects a change in Miltenyi manufacturing costs resulting from,19,False,False
13,13,"such Bellicum-Requested Change, Miltenyi shall use [...***...] to implement the proposed Bellicum-Requested Change. For clarity, an",16,50.04999923706055,202.3771514892578,544.9494018554688,211.2146453857422,494.9244,8.86249,False,such BellicumRequested Change Miltenyi shall use  to implement the proposed BellicumRequested Change For clarity an,15,"such Bellicum-Requested Change, Miltenyi shall use [...***...] to implement the proposed Bellicum-Requested Change. For clarity, an",16,False,False
13,14,agreed adjustment to the Product Price shall become effective only with respect to orders for Miltenyi Products that are manufactured in,21,50.04999923706055,212.4767608642578,544.9498901367188,221.3142547607422,494.92489,8.86249,False,agreed adjustment to the Product Price shall become effective only with respect to orders for Miltenyi Products that are manufactured in,21,agreed adjustment to the Product Price shall become effective only with respect to orders for Miltenyi Products that are manufactured in,21,False,False
13,15,accordance with the Bellicum-Requested Change.,5,50.04999923706055,222.5763702392578,226.79994201660156,231.4138641357422,176.77494,8.86249,False,accordance with the BellicumRequested Change,5,accordance with the Bellicum-Requested Change.,5,False,False
13,16,(e) Changes Requested by Miltenyi. If during the Term Miltenyi wishes to make any Material Change not necessary to comply with,21,50.04999923706055,240.8830108642578,544.9496459960938,249.7205047607422,494.92465,8.86249,False,e Changes Requested by Miltenyi If during the Term Miltenyi wishes to make any Material Change not necessary to comply with,21,(e) Changes Requested by Miltenyi. If during the Term Miltenyi wishes to make any Material Change not necessary to comply with,21,False,False
13,17,"changes in Agreed Standards made by Regulatory Authorities, Applicable Laws or other requirements of Regulatory Authorities (in each",18,50.04999923706055,251.6144561767578,544.9500732421875,260.45196533203125,494.92507,8.86251,False,changes in Agreed Standards made by Regulatory Authorities Applicable Laws or other requirements of Regulatory Authorities in each,18,"changes in Agreed Standards made by Regulatory Authorities, Applicable Laws or other requirements of Regulatory Authorities (in each",18,False,False
13,18,"case, a “Miltenyi-Requested Change”), Miltenyi shall notify Bellicum in accordance with the Change Notification procedures set forth in",18,50.04999923706055,261.71405029296875,544.9505004882812,270.55157470703125,494.9255,8.86252,False,case a MiltenyiRequested Change Miltenyi shall notify Bellicum in accordance with the Change Notification procedures set forth in,18,"case, a “Miltenyi-Requested Change”), Miltenyi shall notify Bellicum in accordance with the Change Notification procedures set forth in",18,False,False
13,19,Section 3.2(b) and the Quality Agreement before implementation of such Miltenyi-Requested Change (including at least 6 months advance,18,50.04999923706055,271.81463623046875,544.9501342773438,280.65216064453125,494.92514,8.86252,False,Section 32b and the Quality Agreement before implementation of such MiltenyiRequested Change including at least 6 months advance,18,Section .(b) and the Quality Agreement before implementation of such Miltenyi-Requested Change (including at least  months advance,17,False,False
13,20,"written notice prior to implementation), and shall keep Bellicum advised of its efforts to effectuate such change. Miltenyi shall use its best",22,50.04999923706055,281.91424560546875,544.949951171875,290.75177001953125,494.92495,8.86252,False,written notice prior to implementation and shall keep Bellicum advised of its efforts to effectuate such change Miltenyi shall use its best,22,"written notice prior to implementation), and shall keep Bellicum advised of its efforts to effectuate such change. Miltenyi shall use its best",22,False,False
13,21,efforts to provide to Bellicum with a commercially reaosnable number of samples of the “Changed Miltenyi Product” (meaning such,19,50.04999923706055,292.01385498046875,544.9501342773438,300.85137939453125,494.92514,8.86252,False,efforts to provide to Bellicum with a commercially reaosnable number of samples of the Changed Miltenyi Product meaning such,19,efforts to provide to Bellicum with a commercially reaosnable number of samples of the “Changed Miltenyi Product” (meaning such,19,False,False
13,22,Miltenyi Product that is produced under conditions of the Miltenyi-Requested Change) for evaluation by Bellicum as soon as such,19,50.04999923706055,302.11444091796875,544.9498901367188,310.95196533203125,494.92489,8.86252,False,Miltenyi Product that is produced under conditions of the MiltenyiRequested Change for evaluation by Bellicum as soon as such,19,Miltenyi Product that is produced under conditions of the Miltenyi-Requested Change) for evaluation by Bellicum as soon as such,19,False,False
13,23,Changed Miltenyi Product becomes available during the post-noficiation period. Miltenyi shall be responsible for drafting relevant,16,50.04999923706055,312.21405029296875,544.949951171875,321.05157470703125,494.92495,8.86252,False,Changed Miltenyi Product becomes available during the postnoficiation period Miltenyi shall be responsible for drafting relevant,16,Changed Miltenyi Product becomes available during the post-noficiation period. Miltenyi shall be responsible for drafting relevant,16,False,False
13,24,documentation and shall provide to Bellicum any information reasonably necessary for Bellicum to make appropriate filings with the,18,50.04999923706055,322.31463623046875,544.9503173828125,331.15216064453125,494.92532,8.86252,False,documentation and shall provide to Bellicum any information reasonably necessary for Bellicum to make appropriate filings with the,18,documentation and shall provide to Bellicum any information reasonably necessary for Bellicum to make appropriate filings with the,18,False,False
13,25,applicable Regulatory Authority for Bellicum to obtain any required amendment or other modification of the Bellicum Product regulatory,18,50.04999923706055,332.41424560546875,544.9500732421875,341.25177001953125,494.92507,8.86252,False,applicable Regulatory Authority for Bellicum to obtain any required amendment or other modification of the Bellicum Product regulatory,18,applicable Regulatory Authority for Bellicum to obtain any required amendment or other modification of the Bellicum Product regulatory,18,False,False
13,26,"approvals regarding changes under this subsection, if applicable. Miltenyi shall implement such Miltenyi-Requested Change at its own cost",18,50.04999923706055,342.51385498046875,544.94970703125,351.35137939453125,494.92471,8.86252,False,approvals regarding changes under this subsection if applicable Miltenyi shall implement such MiltenyiRequested Change at its own cost,18,"approvals regarding changes under this subsection, if applicable. Miltenyi shall implement such Miltenyi-Requested Change at its own cost",18,False,False
