page,line_enum,text,tokens,x0,y0,x1,y1,width,height,empty_line,only_special,only_special_len,text_wo_numbers,text_wo_numbers_len,text_duplicated,to_delete_line
32,32,"(5) not be adulterated or mislabeled under Applicable Laws, and",10,50.04999923706055,481.39251708984375,276.6688537597656,490.23004150390625,226.64385,8.86252,False,5 not be adulterated or mislabeled under Applicable Laws and,10,"() not be adulterated or mislabeled under Applicable Laws, and",10,False,False
32,33,"(6) at the time of Delivery, be delivered with full title and be free and clear of any lien or encumbrance",21,50.04999923706055,500.33001708984375,413.6498107910156,509.16754150390625,363.62481,8.86252,False,6 at the time of Delivery be delivered with full title and be free and clear of any lien or encumbrance,21,"() at the time of Delivery, be delivered with full title and be free and clear of any lien or encumbrance",21,False,False
33,3,"(collectively, the “Miltenyi Product Warranty”). Bellicum’s remedies and Miltenyi liability with respect to this Miltenyi Product Warranty",17,50.04999923706055,119.68598937988281,544.9500122070312,128.5234832763672,494.92501,8.86249,False,collectively the Miltenyi Product Warranty Bellicums remedies and Miltenyi liability with respect to this Miltenyi Product Warranty,17,"(collectively, the “Miltenyi Product Warranty”). Bellicum’s remedies and Miltenyi liability with respect to this Miltenyi Product Warranty",17,False,False
33,4,are set forth in Section 7.6 and as otherwise expressly set forth in this Agreement.,15,50.04999923706055,129.7860870361328,344.21258544921875,138.6235809326172,294.18759,8.86249,False,are set forth in Section 76 and as otherwise expressly set forth in this Agreement,15,are set forth in Section . and as otherwise expressly set forth in this Agreement.,15,False,False
33,5,"11.2 Additional Miltenyi Representations, Warranties, and Covenants. Miltenyi further represents and warrants and covenants to Bellicum",16,50.04999923706055,149.9860382080078,544.9502563476562,158.8235321044922,494.92526,8.86249,False,112 Additional Miltenyi Representations Warranties and Covenants Miltenyi further represents and warrants and covenants to Bellicum,16,". Additional Miltenyi Representations, Warranties, and Covenants. Miltenyi further represents and warrants and covenants to Bellicum",16,False,False
33,6,that:,1,50.04999923706055,160.7172393798828,65.20000457763672,169.5547332763672,15.17501,8.86249,False,that,1,that:,1,False,False
33,7,"(1) Miltenyi and its Affiliates and Subcontractors have the scientific, technical and other requisite competencies, and full right and power",20,50.04999923706055,179.0233917236328,544.9500732421875,187.8608856201172,494.92507,8.86249,False,1 Miltenyi and its Affiliates and Subcontractors have the scientific technical and other requisite competencies and full right and power,20,"() Miltenyi and its Affiliates and Subcontractors have the scientific, technical and other requisite competencies, and full right and power",20,False,False
33,8,"to perform the obligations set forth in this Agreement, and Miltenyi covenants that during the Term of this Agreement it will not enter into",24,50.04999923706055,189.7548370361328,544.9497680664062,198.5923309326172,494.92477,8.86249,False,to perform the obligations set forth in this Agreement and Miltenyi covenants that during the Term of this Agreement it will not enter into,24,"to perform the obligations set forth in this Agreement, and Miltenyi covenants that during the Term of this Agreement it will not enter into",24,False,False
33,9,any obligation owed to a Third Party that would materially impair Miltenyi’s ability to perform its obligations under this Agreement,20,50.04999923706055,199.8546905517578,544.949462890625,208.6921844482422,494.92446,8.86249,False,any obligation owed to a Third Party that would materially impair Miltenyis ability to perform its obligations under this Agreement,20,any obligation owed to a Third Party that would materially impair Miltenyi’s ability to perform its obligations under this Agreement,20,False,False
33,10,(including Miltenyi’s obligation to supply Miltenyi Products to Bellicum);,9,50.04999923706055,209.9547882080078,308.2311096191406,218.7922821044922,258.20611,8.86249,False,including Miltenyis obligation to supply Miltenyi Products to Bellicum,9,(including Miltenyi’s obligation to supply Miltenyi Products to Bellicum);,9,False,False
33,11,"(2) To Miltenyi’s knowledge and after due inquiry, on the Effective Date, Miltenyi owns all right, title, and interest in and to, or otherwise",24,50.04999923706055,228.2609405517578,544.94970703125,237.0984344482422,494.92471,8.86249,False,2 To Miltenyis knowledge and after due inquiry on the Effective Date Miltenyi owns all right title and interest in and to or otherwise,24,"() To Miltenyi’s knowledge and after due inquiry, on the Effective Date, Miltenyi owns all right, title, and interest in and to, or otherwise",24,False,False
33,12,"possesses all necessary rights and licenses under, the Miltenyi Technology and the Miltenyi Intellectual Property Rights, to perform its",19,50.04999923706055,238.9921417236328,544.9500732421875,247.8296356201172,494.92507,8.86249,False,possesses all necessary rights and licenses under the Miltenyi Technology and the Miltenyi Intellectual Property Rights to perform its,19,"possesses all necessary rights and licenses under, the Miltenyi Technology and the Miltenyi Intellectual Property Rights, to perform its",19,False,False
33,13,obligations under this Agreement;,4,50.04999923706055,249.0922393798828,169.35626220703125,257.92974853515625,119.33126,8.86251,False,obligations under this Agreement,4,obligations under this Agreement;,4,False,False
33,14,"(3) As of the Effective Date, Miltenyi has not received any written communication from any Third Party alleging that the manufacture,",21,50.04999923706055,267.39837646484375,544.9498291015625,276.23590087890625,494.92483,8.86252,False,3 As of the Effective Date Miltenyi has not received any written communication from any Third Party alleging that the manufacture,21,"() As of the Effective Date, Miltenyi has not received any written communication from any Third Party alleging that the manufacture,",21,False,False
33,15,"use, sale, offer for sale or import of any Miltenyi Product infringes any Third Party patent or misappropriates any other Third Party",22,50.04999923706055,278.12982177734375,544.9500732421875,286.96734619140625,494.92507,8.86252,False,use sale offer for sale or import of any Miltenyi Product infringes any Third Party patent or misappropriates any other Third Party,22,"use, sale, offer for sale or import of any Miltenyi Product infringes any Third Party patent or misappropriates any other Third Party",22,False,False
33,16,Intellectual Property Rights; and,4,50.04999923706055,288.22967529296875,164.93756103515625,297.06719970703125,114.91256,8.86252,False,Intellectual Property Rights and,4,Intellectual Property Rights; and,4,False,False
33,17,"(4) To Miltenyi’s knowledge on the Effective Date, except with respect to the agreements listed on Exhibit D hereto there are no",22,50.04999923706055,306.53607177734375,544.9500122070312,315.37359619140625,494.92501,8.86252,False,4 To Miltenyis knowledge on the Effective Date except with respect to the agreements listed on Exhibit D hereto there are no,22,"() To Miltenyi’s knowledge on the Effective Date, except with respect to the agreements listed on Exhibit D hereto there are no",22,False,False
33,18,agreements between Miltenyi and a Third Party that would impose any payment obligation on Bellicum with respect to the use of Miltenyi,22,50.04999923706055,317.26727294921875,544.9500732421875,326.10479736328125,494.92507,8.86252,False,agreements between Miltenyi and a Third Party that would impose any payment obligation on Bellicum with respect to the use of Miltenyi,22,agreements between Miltenyi and a Third Party that would impose any payment obligation on Bellicum with respect to the use of Miltenyi,22,False,False
33,19,"Product in connection with the manufacture, use or sale of any Bellicum Product, or any Bellicum use within the Permitted Use.",21,50.04999923706055,327.36712646484375,507.70672607421875,336.20465087890625,457.68173,8.86252,False,Product in connection with the manufacture use or sale of any Bellicum Product or any Bellicum use within the Permitted Use,21,"Product in connection with the manufacture, use or sale of any Bellicum Product, or any Bellicum use within the Permitted Use.",21,False,False
33,20,"11.3 Bellicum Representations, Warranties, and Covenants. Bellicum represents, warrants and covenants to Miltenyi that:",14,50.04999923706055,345.67352294921875,479.2999267578125,354.51104736328125,429.27493,8.86252,False,113 Bellicum Representations Warranties and Covenants Bellicum represents warrants and covenants to Miltenyi that,14,". Bellicum Representations, Warranties, and Covenants. Bellicum represents, warrants and covenants to Miltenyi that:",14,False,False
33,21,"(1) Bellicum has the scientific, technical and other requisite competencies to determine the suitability of each Miltenyi Product purchased",19,50.04999923706055,364.61102294921875,544.9501342773438,373.44854736328125,494.92514,8.86252,False,1 Bellicum has the scientific technical and other requisite competencies to determine the suitability of each Miltenyi Product purchased,19,"() Bellicum has the scientific, technical and other requisite competencies to determine the suitability of each Miltenyi Product purchased",19,False,False
33,22,hereunder for the use to which Bellicum will put such Miltenyi Product;,12,50.04999923706055,375.34222412109375,306.33740234375,384.17974853515625,256.3124,8.86252,False,hereunder for the use to which Bellicum will put such Miltenyi Product,12,hereunder for the use to which Bellicum will put such Miltenyi Product;,12,False,False
33,23,"(2) As of the Effective Date, the Product Specifications are adequate to confirm the suitability of the Miltenyi Product (including its",21,50.04999923706055,393.64837646484375,544.9501342773438,402.48590087890625,494.92514,8.86252,False,2 As of the Effective Date the Product Specifications are adequate to confirm the suitability of the Miltenyi Product including its,21,"() As of the Effective Date, the Product Specifications are adequate to confirm the suitability of the Miltenyi Product (including its",21,False,False
33,24,packaging and labelling) for the uses to which such Miltenyi Product will be put by Bellicum;,16,50.04999923706055,404.37982177734375,382.0877990722656,413.21734619140625,332.0628,8.86252,False,packaging and labelling for the uses to which such Miltenyi Product will be put by Bellicum,16,packaging and labelling) for the uses to which such Miltenyi Product will be put by Bellicum;,16,False,False
33,25,"(3) Bellicum will perform, and will cause its Subcontractors and Licensees to perform, sufficient incoming inspection of each supplied",19,50.04999923706055,422.68597412109375,544.9498901367188,431.52349853515625,494.92489,8.86252,False,3 Bellicum will perform and will cause its Subcontractors and Licensees to perform sufficient incoming inspection of each supplied,19,"() Bellicum will perform, and will cause its Subcontractors and Licensees to perform, sufficient incoming inspection of each supplied",19,False,False
33,26,Miltenyi Product to comply with its obligations under this Agreement and under all Applicable Laws; and,16,50.04999923706055,433.41717529296875,423.11871337890625,442.25469970703125,373.09371,8.86252,False,Miltenyi Product to comply with its obligations under this Agreement and under all Applicable Laws and,16,Miltenyi Product to comply with its obligations under this Agreement and under all Applicable Laws; and,16,False,False
33,27,(4) Bellicum shall manufacture (and require and ensure that any Subcontractor or Licensee will manufacture) Bellicum Products using,18,50.04999923706055,451.72357177734375,544.9498901367188,460.56109619140625,494.92489,8.86252,False,4 Bellicum shall manufacture and require and ensure that any Subcontractor or Licensee will manufacture Bellicum Products using,18,() Bellicum shall manufacture (and require and ensure that any Subcontractor or Licensee will manufacture) Bellicum Products using,18,False,False
33,28,appropriate standards of care and quality in accordance with Applicable Laws and all requirements of Regulatory Authorities applicable to,19,50.04999923706055,462.45477294921875,544.9502563476562,471.29229736328125,494.92526,8.86252,False,appropriate standards of care and quality in accordance with Applicable Laws and all requirements of Regulatory Authorities applicable to,19,appropriate standards of care and quality in accordance with Applicable Laws and all requirements of Regulatory Authorities applicable to,19,False,False
33,29,such manufacture; and,3,50.04999923706055,472.55462646484375,132.1125030517578,481.39215087890625,82.0875,8.86252,False,such manufacture and,3,such manufacture; and,3,False,False
33,30,"(5) Bellicum shall use, and will cause its Subcontractors and Licensees to use, Miltenyi Products in accordance with all Applicable Laws",21,50.04999923706055,490.86102294921875,544.9506225585938,499.69854736328125,494.92562,8.86252,False,5 Bellicum shall use and will cause its Subcontractors and Licensees to use Miltenyi Products in accordance with all Applicable Laws,21,"() Bellicum shall use, and will cause its Subcontractors and Licensees to use, Miltenyi Products in accordance with all Applicable Laws",21,False,False
33,31,and all requirements of Regulatory Authorities applicable to such use.,10,50.04999923706055,501.59222412109375,296.8688659667969,510.42974853515625,246.84387,8.86252,False,and all requirements of Regulatory Authorities applicable to such use,10,and all requirements of Regulatory Authorities applicable to such use.,10,False,False
34,3,11.4 Disclaimer.,2,50.04999923706055,100.74751281738281,107.1781234741211,109.58501434326172,57.15312,8.8625,False,114 Disclaimer,2,. Disclaimer.,2,False,False
34,4,"(a) EXCEPT AS EXPRESSLY SET FORTH IN THIS AGREEMENT, NEITHER PARTY MAKES ANY REPRESENTATIONS OR",15,50.04999923706055,119.68501281738281,544.9503173828125,128.5225067138672,494.92532,8.86249,False,a EXCEPT AS EXPRESSLY SET FORTH IN THIS AGREEMENT NEITHER PARTY MAKES ANY REPRESENTATIONS OR,15,"(a) EXCEPT AS EXPRESSLY SET FORTH IN THIS AGREEMENT, NEITHER PARTY MAKES ANY REPRESENTATIONS OR",15,False,False
34,5,"EXTENDS ANY WARRANTIES OF ANY KIND, EITHER EXPRESS OR IMPLIED, AND EACH PARTY EXPRESSLY DISCLAIMS ALL",16,50.04999923706055,130.4162139892578,544.9496459960938,139.2537078857422,494.92465,8.86249,False,EXTENDS ANY WARRANTIES OF ANY KIND EITHER EXPRESS OR IMPLIED AND EACH PARTY EXPRESSLY DISCLAIMS ALL,16,"EXTENDS ANY WARRANTIES OF ANY KIND, EITHER EXPRESS OR IMPLIED, AND EACH PARTY EXPRESSLY DISCLAIMS ALL",16,False,False
34,6,"IMPLIED WARRANTIES OF MERCHANTABILITY AND OF FITNESS FOR A PARTICULAR PURPOSE OR USE, NON-",14,50.04999923706055,140.5163116455078,544.949951171875,149.3538055419922,494.92495,8.86249,False,IMPLIED WARRANTIES OF MERCHANTABILITY AND OF FITNESS FOR A PARTICULAR PURPOSE OR USE NON,14,"IMPLIED WARRANTIES OF MERCHANTABILITY AND OF FITNESS FOR A PARTICULAR PURPOSE OR USE, NON-",14,False,False
34,7,"INFRINGEMENT, VALIDITY AND ENFORCEABILITY OF PATENTS, OR THE PROSPECTS OR LIKELIHOOD OF DEVELOPMENT",13,50.04999923706055,150.6164093017578,544.9497680664062,159.4539031982422,494.92477,8.86249,False,INFRINGEMENT VALIDITY AND ENFORCEABILITY OF PATENTS OR THE PROSPECTS OR LIKELIHOOD OF DEVELOPMENT,13,"INFRINGEMENT, VALIDITY AND ENFORCEABILITY OF PATENTS, OR THE PROSPECTS OR LIKELIHOOD OF DEVELOPMENT",13,False,False
34,8,OR COMMERCIAL SUCCESS OF PRODUCT.,5,50.04999923706055,160.7162628173828,219.856201171875,169.5537567138672,169.8312,8.86249,False,OR COMMERCIAL SUCCESS OF PRODUCT,5,OR COMMERCIAL SUCCESS OF PRODUCT.,5,False,False
34,9,"(b) Notwithstanding the generality of clause (a) above, Miltenyi hereby expressly disclaims any warranty that (i) the Miltenyi Products will",20,50.04999923706055,179.0226593017578,544.949951171875,187.8601531982422,494.92495,8.86249,False,b Notwithstanding the generality of clause a above Miltenyi hereby expressly disclaims any warranty that i the Miltenyi Products will,20,"(b) Notwithstanding the generality of clause (a) above, Miltenyi hereby expressly disclaims any warranty that (i) the Miltenyi Products will",20,False,False
34,10,"be suitable for the development or manufacturing of a Bellicum Product, or (ii) Bellicum’s intended use of the Miltenyi Products for the",22,50.04999923706055,189.7538604736328,544.949951171875,198.5913543701172,494.92495,8.86249,False,be suitable for the development or manufacturing of a Bellicum Product or ii Bellicums intended use of the Miltenyi Products for the,22,"be suitable for the development or manufacturing of a Bellicum Product, or (ii) Bellicum’s intended use of the Miltenyi Products for the",22,False,False
34,11,"development or manufacturing of Bellicum Product will be approved by any Regulatory Authority, or (iii) the Miltenyi Products will",19,50.04999923706055,199.8537139892578,544.950439453125,208.6912078857422,494.92544,8.86249,False,development or manufacturing of Bellicum Product will be approved by any Regulatory Authority or iii the Miltenyi Products will,19,"development or manufacturing of Bellicum Product will be approved by any Regulatory Authority, or (iii) the Miltenyi Products will",19,False,False
34,12,otherwise be suitable in any respect for a Permitted Use or be commercially exploitable or profitable.,16,50.04999923706055,209.9538116455078,408.6002502441406,218.7913055419922,358.57525,8.86249,False,otherwise be suitable in any respect for a Permitted Use or be commercially exploitable or profitable,16,otherwise be suitable in any respect for a Permitted Use or be commercially exploitable or profitable.,16,False,False
34,13,"(c) In no event shall Miltenyi or its Affiliates be responsible or liable for any non-conformance or other defects in the Miltenyi Product(s),",23,50.04999923706055,228.2599639892578,544.9501953125,237.0974578857422,494.9252,8.86249,False,c In no event shall Miltenyi or its Affiliates be responsible or liable for any nonconformance or other defects in the Miltenyi Products,23,"(c) In no event shall Miltenyi or its Affiliates be responsible or liable for any non-conformance or other defects in the Miltenyi Product(s),",23,False,False
34,14,"including any non-conformance with the warranties in Section 11.1 and 11.2, to the extent resulting from improper use, handling, storage,",20,50.04999923706055,238.9914093017578,544.9498291015625,247.8289031982422,494.92483,8.86249,False,including any nonconformance with the warranties in Section 111 and 112 to the extent resulting from improper use handling storage,20,"including any non-conformance with the warranties in Section . and ., to the extent resulting from improper use, handling, storage,",20,False,False
34,15,"transportation, or disposal of the Miltenyi Product(s) after Delivery thereof (including without limitation failure to use the Miltenyi",18,50.04999923706055,249.0912628173828,544.9501953125,257.92877197265625,494.9252,8.86251,False,transportation or disposal of the Miltenyi Products after Delivery thereof including without limitation failure to use the Miltenyi,18,"transportation, or disposal of the Miltenyi Product(s) after Delivery thereof (including without limitation failure to use the Miltenyi",18,False,False
34,16,"Product(s) in accordance with the terms of this Agreement or the Product Specifications), accident, or from any other cause not",20,50.04999923706055,259.19134521484375,544.9493408203125,268.02886962890625,494.92434,8.86252,False,Products in accordance with the terms of this Agreement or the Product Specifications accident or from any other cause not,20,"Product(s) in accordance with the terms of this Agreement or the Product Specifications), accident, or from any other cause not",20,False,False
34,17,attributable to defective workmanship or failure to meet the Miltenyi Product Warranty on the part of Miltenyi or its Affiliates.,20,50.04999923706055,269.29119873046875,498.2373352050781,278.12872314453125,448.21234,8.86252,False,attributable to defective workmanship or failure to meet the Miltenyi Product Warranty on the part of Miltenyi or its Affiliates,20,attributable to defective workmanship or failure to meet the Miltenyi Product Warranty on the part of Miltenyi or its Affiliates.,20,False,False
34,18,"(d) Miltenyi’s warranty under Section 11.2 does not relate to the potential uses of Miltenyi Products by Bellicum, its Subcontractors or",21,50.04999923706055,287.59759521484375,544.9502563476562,296.43511962890625,494.92526,8.86252,False,d Miltenyis warranty under Section 112 does not relate to the potential uses of Miltenyi Products by Bellicum its Subcontractors or,21,"(d) Miltenyi’s warranty under Section . does not relate to the potential uses of Miltenyi Products by Bellicum, its Subcontractors or",21,False,False
34,19,"Licensees in relation to Third Party rights, even if foreseeable. Bellicum acknowledges that there may be proprietary rights owned by",20,50.04999923706055,298.32879638671875,544.95068359375,307.16632080078125,494.92568,8.86252,False,Licensees in relation to Third Party rights even if foreseeable Bellicum acknowledges that there may be proprietary rights owned by,20,"Licensees in relation to Third Party rights, even if foreseeable. Bellicum acknowledges that there may be proprietary rights owned by",20,False,False
34,20,Third Parties that may be necessary or desirable for the use of Miltenyi Products in connection with processes for the production and/or,22,50.04999923706055,308.42877197265625,544.9502563476562,317.26629638671875,494.92526,8.86252,False,Third Parties that may be necessary or desirable for the use of Miltenyi Products in connection with processes for the production andor,22,Third Parties that may be necessary or desirable for the use of Miltenyi Products in connection with processes for the production and/or,22,False,False
34,21,"use of Bellicum Products, and Bellicum agrees that (i) securing access to such Third Party rights regarding such use of Miltenyi Products",22,50.04999923706055,318.52886962890625,544.9498901367188,327.36639404296875,494.92489,8.86252,False,use of Bellicum Products and Bellicum agrees that i securing access to such Third Party rights regarding such use of Miltenyi Products,22,"use of Bellicum Products, and Bellicum agrees that (i) securing access to such Third Party rights regarding such use of Miltenyi Products",22,False,False
34,22,"in the manufacture or use of a Bellicum Product is Bellicum’s responsibility, and (ii) neither Miltenyi nor any of its Affiliates has any",23,50.04999923706055,328.62884521484375,544.9501953125,337.46636962890625,494.9252,8.86252,False,in the manufacture or use of a Bellicum Product is Bellicums responsibility and ii neither Miltenyi nor any of its Affiliates has any,23,"in the manufacture or use of a Bellicum Product is Bellicum’s responsibility, and (ii) neither Miltenyi nor any of its Affiliates has any",23,False,False
34,23,responsibility or liability with respect to any such Third Party proprietary rights regarding such use of Miltenyi Products in the,20,50.04999923706055,338.72882080078125,544.9498291015625,347.56634521484375,494.92483,8.86252,False,responsibility or liability with respect to any such Third Party proprietary rights regarding such use of Miltenyi Products in the,20,responsibility or liability with respect to any such Third Party proprietary rights regarding such use of Miltenyi Products in the,20,False,False
34,24,manufacture or use of a Bellicum Product.,7,50.04999923706055,348.82879638671875,202.18125915527344,357.66632080078125,152.15626,8.86252,False,manufacture or use of a Bellicum Product,7,manufacture or use of a Bellicum Product.,7,False,False
34,25,11.5 Remedies.,2,50.04999923706055,367.13507080078125,103.390625,375.97259521484375,53.36563,8.86252,False,115 Remedies,2,. Remedies.,2,False,False
34,26,"(a) Miltenyi’s sole obligation, and Bellicum’s sole and exclusive remedy for breach of the Miltenyi Product Warranty in Section 11.1, shall",21,50.04999923706055,386.07257080078125,544.9501953125,394.91009521484375,494.9252,8.86252,False,a Miltenyis sole obligation and Bellicums sole and exclusive remedy for breach of the Miltenyi Product Warranty in Section 111 shall,21,"(a) Miltenyi’s sole obligation, and Bellicum’s sole and exclusive remedy for breach of the Miltenyi Product Warranty in Section ., shall",21,False,False
34,27,"be as set forth in Article 7, including replacement or refund in accordance with Section 7.6, provided that Miltenyi shall pay reasonable",22,50.04999923706055,396.80377197265625,544.9503784179688,405.64129638671875,494.92538,8.86252,False,be as set forth in Article 7 including replacement or refund in accordance with Section 76 provided that Miltenyi shall pay reasonable,22,"be as set forth in Article , including replacement or refund in accordance with Section ., provided that Miltenyi shall pay reasonable",22,False,False
34,28,return freight and shipping charges.,5,50.04999923706055,406.90386962890625,177.5625457763672,415.74139404296875,127.53755,8.86252,False,return freight and shipping charges,5,return freight and shipping charges.,5,False,False
